{"schema_version": "biojspace/decodon-1.0", "model": {"name": "DeCodon-200M", "repo": "goodarzilab/decodon-200M", "type": "autoregressive_codon_lm", "n_layers": 12, "hidden_size": 1024, "vocab": "5 special + 64 codon + 1667 taxid tokens"}, "sequence_id": "ecoli_demo_gene", "organism_default": "E. coli (562)", "organisms": ["E. coli (562)", "B. subtilis (1423)", "P. aeruginosa (287)"], "tokens": [{"pos": 0, "codon": "ATG", "aa": "M", "aa3": "Met", "frame": 0}, {"pos": 1, "codon": "CTG", "aa": "L", "aa3": "Leu", "frame": 0}, {"pos": 2, "codon": "ATT", "aa": "I", "aa3": "Ile", "frame": 0}, {"pos": 3, "codon": "CTT", "aa": "L", "aa3": "Leu", "frame": 0}, {"pos": 4, "codon": "ATT", "aa": "I", "aa3": "Ile", "frame": 0}, {"pos": 5, "codon": "TCA", "aa": "S", "aa3": "Ser", "frame": 0}, {"pos": 6, "codon": "CCT", "aa": "P", "aa3": "Pro", "frame": 0}, {"pos": 7, "codon": "GCG", "aa": "A", "aa3": "Ala", "frame": 0}, {"pos": 8, "codon": "AAA", "aa": "K", "aa3": "Lys", "frame": 0}, {"pos": 9, "codon": "ACG", "aa": "T", "aa3": "Thr", "frame": 0}, {"pos": 10, "codon": "CTT", "aa": "L", "aa3": "Leu", "frame": 0}, {"pos": 11, "codon": "GAT", "aa": "D", "aa3": "Asp", "frame": 0}, {"pos": 12, "codon": "TAC", "aa": "Y", "aa3": "Tyr", "frame": 0}, {"pos": 13, "codon": "CAA", "aa": "Q", "aa3": "Gln", "frame": 0}, {"pos": 14, "codon": "AGC", "aa": "S", "aa3": "Ser", "frame": 0}, {"pos": 15, "codon": "CCG", "aa": "P", "aa3": "Pro", "frame": 0}, {"pos": 16, "codon": "TTG", "aa": "L", "aa3": "Leu", "frame": 0}, {"pos": 17, "codon": "ACC", "aa": "T", "aa3": "Thr", "frame": 0}, {"pos": 18, "codon": "ACC", "aa": "T", "aa3": "Thr", "frame": 0}, {"pos": 19, "codon": "ACG", "aa": "T", "aa3": "Thr", "frame": 0}, {"pos": 20, "codon": "CGC", "aa": "R", "aa3": "Arg", "frame": 0}, {"pos": 21, "codon": "TAT", "aa": "Y", "aa3": "Tyr", "frame": 0}, {"pos": 22, "codon": "ACG", "aa": "T", "aa3": "Thr", "frame": 0}, {"pos": 23, "codon": "CTG", "aa": "L", "aa3": "Leu", "frame": 0}, {"pos": 24, "codon": "CCG", "aa": "P", "aa3": "Pro", "frame": 0}, {"pos": 25, "codon": "GAG", "aa": "E", "aa3": "Glu", "frame": 0}, {"pos": 26, "codon": "CTG", "aa": "L", "aa3": "Leu", "frame": 0}, {"pos": 27, "codon": "TTA", "aa": "L", "aa3": "Leu", "frame": 0}, {"pos": 28, "codon": "GAC", "aa": "D", "aa3": "Asp", "frame": 0}, {"pos": 29, "codon": "AAT", "aa": "N", "aa3": "Asn", "frame": 0}, {"pos": 30, "codon": "TCC", "aa": "S", "aa3": "Ser", "frame": 0}, {"pos": 31, "codon": "CAG", "aa": "Q", "aa3": "Gln", "frame": 0}, {"pos": 32, "codon": "CAG", "aa": "Q", "aa3": "Gln", "frame": 0}, {"pos": 33, "codon": "TTG", "aa": "L", "aa3": "Leu", "frame": 0}, {"pos": 34, "codon": "ATC", "aa": "I", "aa3": "Ile", "frame": 0}, {"pos": 35, "codon": "CAT", "aa": "H", "aa3": "His", "frame": 0}, {"pos": 36, "codon": "GAG", "aa": "E", "aa3": "Glu", "frame": 0}, {"pos": 37, "codon": "GCG", "aa": "A", "aa3": "Ala", "frame": 0}, {"pos": 38, "codon": "CGG", "aa": "R", "aa3": "Arg", "frame": 0}, {"pos": 39, "codon": "AAA", "aa": "K", "aa3": "Lys", "frame": 0}, {"pos": 40, "codon": "CTG", "aa": "L", "aa3": "Leu", "frame": 0}, {"pos": 41, "codon": "ACG", "aa": "T", "aa3": "Thr", "frame": 0}, {"pos": 42, "codon": "CCT", "aa": "P", "aa3": "Pro", "frame": 0}, {"pos": 43, "codon": "CCG", "aa": "P", "aa3": "Pro", "frame": 0}, {"pos": 44, "codon": "CAG", "aa": "Q", "aa3": "Gln", "frame": 0}, {"pos": 45, "codon": "ATT", "aa": "I", "aa3": "Ile", "frame": 0}, {"pos": 46, "codon": "AGC", "aa": "S", "aa3": "Ser", "frame": 0}, {"pos": 47, "codon": "ACG", "aa": "T", "aa3": "Thr", "frame": 0}, {"pos": 48, "codon": "CTG", "aa": "L", "aa3": "Leu", "frame": 0}, {"pos": 49, "codon": "ATG", "aa": "M", "aa3": "Met", "frame": 0}, {"pos": 50, "codon": "CGC", "aa": "R", "aa3": "Arg", "frame": 0}, {"pos": 51, "codon": "ATC", "aa": "I", "aa3": "Ile", "frame": 0}, {"pos": 52, "codon": "AGC", "aa": "S", "aa3": "Ser", "frame": 0}, {"pos": 53, "codon": "GAC", "aa": "D", "aa3": "Asp", "frame": 0}, {"pos": 54, "codon": "AAA", "aa": "K", "aa3": "Lys", "frame": 0}, {"pos": 55, "codon": "CTG", "aa": "L", "aa3": "Leu", "frame": 0}, {"pos": 56, "codon": "GCG", "aa": "A", "aa3": "Ala", "frame": 0}, {"pos": 57, "codon": "GGT", "aa": "G", "aa3": "Gly", "frame": 0}, {"pos": 58, "codon": "ATC", "aa": "I", "aa3": "Ile", "frame": 0}, {"pos": 59, "codon": "AAC", "aa": "N", "aa3": "Asn", "frame": 0}], "per_organism": {"E. coli (562)": [{"pos": 0, "aa_readout": [{"label": "Met", "kind": "aa_mean", "score": 0.8599}, {"label": "Val", "kind": "aa_mean", "score": 0.0554}, {"label": "Leu", "kind": "aa_mean", "score": 0.0414}, {"label": "Ile", "kind": "aa_mean", "score": 0.0094}, {"label": "Ala", "kind": "aa_mean", "score": 0.0036}], "synonym_readout": [{"label": "ATG", "kind": "codon", "score": 1.0}], "synonym_entropy": -0.0, "aa_confidence": 0.8599, "true_codon": "ATG", "true_aa": "Met"}, {"pos": 1, "aa_readout": [{"label": "Ser", "kind": "aa_mean", "score": 0.1045}, {"label": "Leu", "kind": "aa_mean", "score": 0.0865}, {"label": "Lys", "kind": "aa_mean", "score": 0.0858}, {"label": "Asn", "kind": "aa_mean", "score": 0.0759}, {"label": "Ala", "kind": "aa_mean", "score": 0.0663}], "synonym_readout": [{"label": "CTG", "kind": "codon", "score": 0.2996}, {"label": "TTG", "kind": "codon", "score": 0.1931}, {"label": "CTT", "kind": "codon", "score": 0.1594}, {"label": "TTA", "kind": "codon", "score": 0.1402}, {"label": "CTC", "kind": "codon", "score": 0.1107}, {"label": "CTA", "kind": "codon", "score": 0.0971}], "synonym_entropy": 0.958, "aa_confidence": 0.0865, "true_codon": "CTG", "true_aa": "Leu"}, {"pos": 2, "aa_readout": [{"label": "Lys", "kind": "aa_mean", "score": 0.2059}, {"label": "Thr", "kind": "aa_mean", "score": 0.1057}, {"label": "Ala", "kind": "aa_mean", "score": 0.1021}, {"label": "Ser", "kind": "aa_mean", "score": 0.0851}, {"label": "Leu", "kind": "aa_mean", "score": 0.0831}], "synonym_readout": [{"label": "ATT", "kind": "codon", "score": 0.4523}, {"label": "ATA", "kind": "codon", "score": 0.3605}, {"label": "ATC", "kind": "codon", "score": 0.1872}], "synonym_entropy": 0.947, "aa_confidence": 0.0274, "true_codon": "ATT", "true_aa": "Ile"}, {"pos": 3, "aa_readout": [{"label": "Val", "kind": "aa_mean", "score": 0.4257}, {"label": "Ala", "kind": "aa_mean", "score": 0.122}, {"label": "Ile", "kind": "aa_mean", "score": 0.1119}, {"label": "Ser", "kind": "aa_mean", "score": 0.0564}, {"label": "Leu", "kind": "aa_mean", "score": 0.0525}], "synonym_readout": [{"label": "CTT", "kind": "codon", "score": 0.5864}, {"label": "CTG", "kind": "codon", "score": 0.159}, {"label": "TTA", "kind": "codon", "score": 0.1008}, {"label": "CTC", "kind": "codon", "score": 0.0788}, {"label": "TTG", "kind": "codon", "score": 0.0583}, {"label": "CTA", "kind": "codon", "score": 0.0167}], "synonym_entropy": 0.709, "aa_confidence": 0.0525, "true_codon": "CTT", "true_aa": "Leu"}, {"pos": 4, "aa_readout": [{"label": "Val", "kind": "aa_mean", "score": 0.8233}, {"label": "Ile", "kind": "aa_mean", "score": 0.0525}, {"label": "Ala", "kind": "aa_mean", "score": 0.0245}, {"label": "Ser", "kind": "aa_mean", "score": 0.0203}, {"label": "Phe", "kind": "aa_mean", "score": 0.0199}], "synonym_readout": [{"label": "ATC", "kind": "codon", "score": 0.8508}, {"label": "ATT", "kind": "codon", "score": 0.1438}, {"label": "ATA", "kind": "codon", "score": 0.0054}], "synonym_entropy": 0.405, "aa_confidence": 0.0525, "true_codon": "ATT", "true_aa": "Ile"}, {"pos": 5, "aa_readout": [{"label": "Pro", "kind": "aa_mean", "score": 0.2433}, {"label": "Ala", "kind": "aa_mean", "score": 0.2281}, {"label": "Ser", "kind": "aa_mean", "score": 0.1693}, {"label": "Thr", "kind": "aa_mean", "score": 0.0918}, {"label": "Gly", "kind": "aa_mean", "score": 0.0787}], "synonym_readout": [{"label": "TCA", "kind": "codon", "score": 0.8293}, {"label": "TCT", "kind": "codon", "score": 0.0728}, {"label": "TCC", "kind": "codon", "score": 0.0699}, {"label": "AGC", "kind": "codon", "score": 0.0151}, {"label": "TCG", "kind": "codon", "score": 0.0111}, {"label": "AGT", "kind": "codon", "score": 0.0018}], "synonym_entropy": 0.366, "aa_confidence": 0.1693, "true_codon": "TCA", "true_aa": "Ser"}, {"pos": 6, "aa_readout": [{"label": "Leu", "kind": "aa_mean", "score": 0.4723}, {"label": "Pro", "kind": "aa_mean", "score": 0.436}, {"label": "Gly", "kind": "aa_mean", "score": 0.0354}, {"label": "Ser", "kind": "aa_mean", "score": 0.0149}, {"label": "Ala", "kind": "aa_mean", "score": 0.0086}], "synonym_readout": [{"label": "CCT", "kind": "codon", "score": 0.9556}, {"label": "CCC", "kind": "codon", "score": 0.0411}, {"label": "CCG", "kind": "codon", "score": 0.0023}, {"label": "CCA", "kind": "codon", "score": 0.001}], "synonym_entropy": 0.141, "aa_confidence": 0.436, "true_codon": "CCT", "true_aa": "Pro"}, {"pos": 7, "aa_readout": [{"label": "Leu", "kind": "aa_mean", "score": 0.6787}, {"label": "Ala", "kind": "aa_mean", "score": 0.1358}, {"label": "Val", "kind": "aa_mean", "score": 0.0935}, {"label": "Pro", "kind": "aa_mean", "score": 0.0451}, {"label": "Ser", "kind": "aa_mean", "score": 0.0113}], "synonym_readout": [{"label": "GCG", "kind": "codon", "score": 0.535}, {"label": "GCT", "kind": "codon", "score": 0.2987}, {"label": "GCA", "kind": "codon", "score": 0.0914}, {"label": "GCC", "kind": "codon", "score": 0.0749}], "synonym_entropy": 0.8, "aa_confidence": 0.1358, "true_codon": "GCG", "true_aa": "Ala"}, {"pos": 8, "aa_readout": [{"label": "Arg", "kind": "aa_mean", "score": 0.6526}, {"label": "Lys", "kind": "aa_mean", "score": 0.2914}, {"label": "Leu", "kind": "aa_mean", "score": 0.0304}, {"label": "Trp", "kind": "aa_mean", "score": 0.0089}, {"label": "Pro", "kind": "aa_mean", "score": 0.0062}], "synonym_readout": [{"label": "AAA", "kind": "codon", "score": 0.9375}, {"label": "AAG", "kind": "codon", "score": 0.0625}], "synonym_entropy": 0.337, "aa_confidence": 0.2914, "true_codon": "AAA", "true_aa": "Lys"}, {"pos": 9, "aa_readout": [{"label": "Thr", "kind": "aa_mean", "score": 0.9993}, {"label": "Ser", "kind": "aa_mean", "score": 0